<?xml version="1.0" encoding="UTF-8"?>
<!--
Click nbfs://nbhost/SystemFileSystem/Templates/Licenses/license-default.txt to change this license
Click nbfs://nbhost/SystemFileSystem/Templates/XML/XMLDocument.xml to edit this template
-->



<company
    xmlns:xsi='http://www.w3.org/2001/XMLSchema-instance'
    xsi:noNamespaceSchemaLocation='Company.xsd'>
    <employee id="" gender="">
        <name></name>
        <userid></userid>
        <phone></phone>
        <salay></salay>
        <address></address>
    </employee>
    <employee id="" gender="">
        <name></name>
        <userid></userid>
        <phone></phone>
        <salay></salay>
        <address></address>
    </employee>
    <employee id="" gender="">
        <name></name>
        <userid></userid>
        <phone></phone>
        <salay></salay>
        <address></address>
    </employee>

</company>

